{"artifact_schema_version":"1.0","authority_as_of":"2026-08-22T00:00:00+09:00","authority_id":"US_EQUITY_INSTRUMENT_IDENTITY_CURRENT_V1","generated_at":"2026-08-22T14:25:48.895Z","order_authority":false,"records":[{"effective_from":null,"effective_from_basis":"CURRENT_AS_OF_ONLY","effective_to":null,"instrument_type":"EQUITY","primary_listing_operating_mic":"XNYS","primary_listing_segment_mic":"XNYS","primary_listing_venue_name":"New York Stock Exchange","record_status":"VERIFIED","security_class":"COMMON_STOCK","security_name":"Bloom Energy Corporation Common Stock","source_ref_ids":["BE_NYSE_CTA_20260821","BE_SEC_10Q_20260630","BE_SEC_CHARTER_202605","ISO10383_MIC_CSV","ISO10383_MIC_REGISTER"],"ticker":"BE"},{"effective_from":"2026-04-02","effective_from_basis":"VERIFIED_DATE","effective_to":null,"instrument_type":"ETF","primary_listing_operating_mic":"XCBO","primary_listing_segment_mic":"BATS","primary_listing_venue_name":"Cboe BZX Exchange","record_status":"VERIFIED","security_class":"ACTIVELY_MANAGED_ETF","security_name":"Roundhill Memory ETF","source_ref_ids":["DRAM_CBOE_LISTING","DRAM_CBOE_NEW_LISTING","DRAM_SEC_497K","ISO10383_MIC_CSV","ISO10383_MIC_REGISTER"],"ticker":"DRAM"},{"effective_from":"2025-12-09","effective_from_basis":"VERIFIED_DATE","effective_to":null,"instrument_type":"EQUITY","primary_listing_operating_mic":"XNAS","primary_listing_segment_mic":"XNGS","primary_listing_venue_name":"Nasdaq Global Select Market","record_status":"VERIFIED","security_class":"CLASS_A_COMMON_STOCK","security_name":"Fastly, Inc. Class A Common Stock","source_ref_ids":["FSLY_NASDAQ_TRANSFER_2025","FSLY_SEC_10Q_20260630","ISO10383_MIC_CSV","ISO10383_MIC_REGISTER","NASDAQ_CURRENT_SYMBOL_DIRECTORY"],"ticker":"FSLY"},{"effective_from":"2025-03-07","effective_from_basis":"VERIFIED_DATE","effective_to":null,"instrument_type":"ETF","primary_listing_operating_mic":"XNAS","primary_listing_segment_mic":"XNMS","primary_listing_venue_name":"Nasdaq Global Market","record_status":"VERIFIED","security_class":"LEVERAGED_ETF","security_name":"GraniteShares 2x Long MRVL Daily ETF","source_ref_ids":["ISO10383_MIC_CSV","ISO10383_MIC_REGISTER","MVLL_NASDAQ_INFORMATION_CIRCULAR","MVLL_NASDAQ_LISTING_ALERT","MVLL_SPONSOR_PRODUCT"],"ticker":"MVLL"},{"effective_from":"2024-10-21","effective_from_basis":"VERIFIED_DATE","effective_to":null,"instrument_type":"EQUITY","primary_listing_operating_mic":"XNAS","primary_listing_segment_mic":"XNGS","primary_listing_venue_name":"Nasdaq Global Select Market","record_status":"VERIFIED","security_class":"CLASS_A_ORDINARY_SHARES","security_name":"Nebius Group N.V. Class A Ordinary Shares","source_ref_ids":["ISO10383_MIC_CSV","ISO10383_MIC_REGISTER","NBIS_NASDAQ_RESUMPTION","NBIS_SEC_20F_2025"],"ticker":"NBIS"},{"effective_from":null,"effective_from_basis":"CURRENT_AS_OF_ONLY","effective_to":null,"instrument_type":"EQUITY","primary_listing_operating_mic":"XNYS","primary_listing_segment_mic":"XNYS","primary_listing_venue_name":"New York Stock Exchange","record_status":"VERIFIED","security_class":"COMMON_STOCK","security_name":"ServiceNow, Inc. Common Stock","source_ref_ids":["ISO10383_MIC_CSV","ISO10383_MIC_REGISTER","NOW_NYSE_CTA_20260821","NOW_SEC_10Q_20260630"],"ticker":"NOW"},{"effective_from":null,"effective_from_basis":"CURRENT_AS_OF_ONLY","effective_to":null,"instrument_type":"ETF","primary_listing_operating_mic":"XNYS","primary_listing_segment_mic":"ARCX","primary_listing_venue_name":"NYSE Arca","record_status":"VERIFIED","security_class":"LEVERAGED_ETF","security_name":"Direxion Daily Semiconductor Bull 3X ETF","source_ref_ids":["ISO10383_MIC_CSV","ISO10383_MIC_REGISTER","SOXL_NYSE_CTA_20260821","SOXL_SEC_497K_2026","SOXL_SPONSOR_PRODUCT"],"ticker":"SOXL"},{"effective_from":"2021-09-22","effective_from_basis":"VERIFIED_DATE","effective_to":null,"instrument_type":"EQUITY","primary_listing_operating_mic":"XNYS","primary_listing_segment_mic":"XNYS","primary_listing_venue_name":"New York Stock Exchange","record_status":"VERIFIED","security_class":"CLASS_A_COMMON_STOCK","security_name":"Toast, Inc. Class A Common Stock","source_ref_ids":["ISO10383_MIC_CSV","ISO10383_MIC_REGISTER","TOST_NYSE_CTA_20260821","TOST_SEC_10Q_20260630"],"ticker":"TOST"}],"registry_version":"2026-08-22.1","scope":["BE","DRAM","FSLY","MVLL","NBIS","NOW","SOXL","TOST"],"source_packet_hash":"7094b487cc08a191601874fb92e426d99973bcbd8f6ae574b16e80e4eb16f27e","source_packet_id":"US_EQUITY_INSTRUMENT_IDENTITY_CURRENT_V1_SOURCES_2026-08-22","ticker_namespace":"US_EXCHANGE_LISTED"}
